tests/python/nightly/quantization/andrew_logs2/nvidia.resnet18_v1.i8.conv.uniform.log.tmp
{"input": ["cuda -keys=cuda,gpu -max_num_threads=1024 -thread_warp_size=32", "conv2d_HWNCnc_tensorcore.cuda", [["TENSOR", [14, 14, 32, 256], "int8"], ["TENSOR", [3, 3, 512, 256], "int8"], [2, 2], [1, 1, 1, 1], [1, 1], "int32"], {}], "config": {"index": 19704690, "code_hash": null, "entity": [["block_row_warps", "ot", 1], ["block_col_warps", "ot", 1], ["warp_row_tiles", "ot", 1], ["warp_col_tiles", "ot", 4], ["chunk", "ot", 1], ["fuse_pack", "ot", 0], ["split_block_k_nums", "ot", 8], ["vector_ws", "ot", 1], ["vector_as", "ot", 1], ["reorder_inner", "re", [0, 1]], ["compute_at_AS", "ot", 0], ["compute_at_WS", "ot", 2], ["AS_double_buffer", "ot", 1], ["WS_double_buffer", "ot", 0], ["auto_unroll_max_step", "ot", 1500]]}, "result": [[0.0007227145942622951], 0, 2.1173086166381836, 1615591368.2216265], "version": 0.2, "tvm_version": "0.8.dev0"}
{"input": ["cuda -keys=cuda,gpu -max_num_threads=1024 -thread_warp_size=32", "conv2d_HWNCnc_tensorcore.cuda", [["TENSOR", [14, 14, 32, 256], "int8"], ["TENSOR", [3, 3, 512, 256], "int8"], [2, 2], [1, 1, 1, 1], [1, 1], "int32"], {}], "config": {"index": 1802300, "code_hash": null, "entity": [["block_row_warps", "ot", 4], ["block_col_warps", "ot", 2], ["warp_row_tiles", "ot", 1], ["warp_col_tiles", "ot", 2], ["chunk", "ot", 4], ["fuse_pack", "ot", 0], ["split_block_k_nums", "ot", 32], ["vector_ws", "ot", 1], ["vector_as", "ot", 16], ["reorder_inner", "re", [1, 0]], ["compute_at_AS", "ot", 1], ["compute_at_WS", "ot", 3], ["AS_double_buffer", "ot", 0], ["WS_double_buffer", "ot", 0], ["auto_unroll_max_step", "ot", 0]]}, "result": [[0.0015280342424242423], 0, 2.0366718769073486, 1615591370.0230813], "version": 0.2, "tvm_version": "0.8.dev0"}
{"input": ["cuda -keys=cuda,gpu -max_num_threads=1024 -thread_warp_size=32", "conv2d_HWNCnc_tensorcore.cuda", [["TENSOR", [14, 14, 32, 256], "int8"], ["TENSOR", [3, 3, 512, 256], "int8"], [2, 2], [1, 1, 1, 1], [1, 1], "int32"], {}], "config": {"index": 23660836, "code_hash": null, "entity": [["block_row_warps", "ot", 2], ["block_col_warps", "ot", 4], ["warp_row_tiles", "ot", 2], ["warp_col_tiles", "ot", 2], ["chunk", "ot", 8], ["fuse_pack", "ot", 1], ["split_block_k_nums", "ot", 16], ["vector_ws", "ot", 1], ["vector_as", "ot", 1], ["reorder_inner", "re", [1, 0]], ["compute_at_AS", "ot", 2], ["compute_at_WS", "ot", 1], ["AS_double_buffer", "ot", 1], ["WS_double_buffer", "ot", 1], ["auto_unroll_max_step", "ot", 1500]]}, "result": [[0.0011032218897058823], 0, 4.34687876701355, 1615591371.5138009], "version": 0.2, "tvm_version": "0.8.dev0"}
{"input": ["cuda -keys=cuda,gpu -max_num_threads=1024 -thread_warp_size=32", "conv2d_HWNCnc_tensorcore.cuda", [["TENSOR", [14, 14, 32, 256], "int8"], ["TENSOR", [3, 3, 512, 256], "int8"], [2, 2], [1, 1, 1, 1], [1, 1], "int32"], {}], "config": {"index": 24072319, "code_hash": null, "entity": [["block_row_warps", "ot", 2], ["block_col_warps", "ot", 1], ["warp_row_tiles", "ot", 4], ["warp_col_tiles", "ot", 1], ["chunk", "ot", 1], ["fuse_pack", "ot", 1], ["split_block_k_nums", "ot", 32], ["vector_ws", "ot", 1], ["vector_as", "ot", 8], ["reorder_inner", "re", [1, 0]], ["compute_at_AS", "ot", 1], ["compute_at_WS", "ot", 2], ["AS_double_buffer", "ot", 1], ["WS_double_buffer", "ot", 1], ["auto_unroll_max_step", "ot", 1500]]}, "result": [[0.0025914382931034484], 0, 3.1025428771972656, 1615591373.1239626], "version": 0.2, "tvm_version": "0.8.dev0"}
{"input": ["cuda -keys=cuda,gpu -max_num_threads=1024 -thread_warp_size=32", "conv2d_HWNCnc_tensorcore.cuda", [["TENSOR", [14, 14, 32, 256], "int8"], ["TENSOR", [3, 3, 512, 256], "int8"], [2, 2], [1, 1, 1, 1], [1, 1], "int32"], {}], "config": {"index": 12704896, "code_hash": null, "entity": [["block_row_warps", "ot", 2], ["block_col_warps", "ot", 1], ["warp_row_tiles", "ot", 1], ["warp_col_tiles", "ot", 2], ["chunk", "ot", 4], ["fuse_pack", "ot", 0], ["split_block_k_nums", "ot", 4], ["vector_ws", "ot", 1], ["vector_as", "ot", 1], ["reorder_inner", "re", [0, 1]], ["compute_at_AS", "ot", 2], ["compute_at_WS", "ot", 0], ["AS_double_buffer", "ot", 0], ["WS_double_buffer", "ot", 1], ["auto_unroll_max_step", "ot", 512]]}, "result": [[0.0005017354682274247], 0, 3.0567538738250732, 1615591374.5270379], "version": 0.2, "tvm_version": "0.8.dev0"}
{"input": ["cuda -keys=cuda,gpu -max_num_threads=1024 -thread_warp_size=32", "conv2d_HWNCnc_tensorcore.cuda", [["TENSOR", [14, 14, 32, 256], "int8"], ["TENSOR", [3, 3, 512, 256], "int8"], [2, 2], [1, 1, 1, 1], [1, 1], "int32"], {}], "config": {"index": 8784021, "code_hash": null, "entity": [["block_row_warps", "ot", 1], ["block_col_warps", "ot", 2], ["warp_row_tiles", "ot", 4], ["warp_col_tiles", "ot", 1], ["chunk", "ot", 1], ["fuse_pack", "ot", 0], ["split_block_k_nums", "ot", 4], ["vector_ws", "ot", 8], ["vector_as", "ot", 8], ["reorder_inner", "re", [1, 0]], ["compute_at_AS", "ot", 3], ["compute_at_WS", "ot", 0], ["AS_double_buffer", "ot", 0], ["WS_double_buffer", "ot", 0], ["auto_unroll_max_step", "ot", 512]]}, "result": [[0.001022619231292517], 0, 2.24706768989563, 1615591375.804047], "version": 0.2, "tvm_version": "0.8.dev0"}
{"input": ["cuda -keys=cuda,gpu -max_num_threads=1024 -thread_warp_size=32", "conv2d_HWNCnc_tensorcore.cuda", [["TENSOR", [14, 14, 32, 256], "int8"], ["TENSOR", [3, 3, 512, 256], "int8"], [2, 2], [1, 1, 1, 1], [1, 1], "int32"], {}], "config": {"index": 8944445, "code_hash": null, "entity": [["block_row_warps", "ot", 4], ["block_col_warps", "ot", 1], ["warp_row_tiles", "ot", 4], ["warp_col_tiles", "ot", 1], ["chunk", "ot", 2], ["fuse_pack", "ot", 0], ["split_block_k_nums", "ot", 2], ["vector_ws", "ot", 1], ["vector_as", "ot", 1], ["reorder_inner", "re", [0, 1]], ["compute_at_AS", "ot", 1], ["compute_at_WS", "ot", 1], ["AS_double_buffer", "ot", 0], ["WS_double_buffer", "ot", 0], ["auto_unroll_max_step", "ot", 512]]}, "result": [[0.000816997195652174], 0, 2.466529607772827, 1615591377.1509635], "version": 0.2, "tvm_version": "0.8.dev0"}
{"input": ["cuda -keys=cuda,gpu -max_num_threads=1024 -thread_warp_size=32", "conv2d_HWNCnc_tensorcore.cuda", [["TENSOR", [14, 14, 32, 256], "int8"], ["TENSOR", [3, 3, 512, 256], "int8"], [2, 2], [1, 1, 1, 1], [1, 1], "int32"], {}], "config": {"index": 10617212, "code_hash": null, "entity": [["block_row_warps", "ot", 4], ["block_col_warps", "ot", 1], ["warp_row_tiles", "ot", 1], ["warp_col_tiles", "ot", 8], ["chunk", "ot", 8], ["fuse_pack", "ot", 0], ["split_block_k_nums", "ot", 1], ["vector_ws", "ot", 8], ["vector_as", "ot", 16], ["reorder_inner", "re", [1, 0]], ["compute_at_AS", "ot", 1], ["compute_at_WS", "ot", 0], ["AS_double_buffer", "ot", 1], ["WS_double_buffer", "ot", 0], ["auto_unroll_max_step", "ot", 512]]}, "result": [[0.0006655272079646019], 0, 5.51822304725647, 1615591378.6632], "version": 0.2, "tvm_version": "0.8.dev0"}
{"input": ["cuda -keys=cuda,gpu -max_num_threads=1024 -thread_warp_size=32", "conv2d_HWNCnc_tensorcore.cuda", [["TENSOR", [14, 14, 32, 256], "int8"], ["TENSOR", [3, 3, 512, 256], "int8"], [2, 2], [1, 1, 1, 1], [1, 1], "int32"], {}], "config": {"index": 2979510, "code_hash": null, "entity": [["block_row_warps", "ot", 1], ["block_col_warps", "ot", 4], ["warp_row_tiles", "ot", 2], ["warp_col_tiles", "ot", 2], ["chunk", "ot", 4], ["fuse_pack", "ot", 0], ["split_block_k_nums", "ot", 32], ["vector_ws", "ot", 8], ["vector_as", "ot", 16], ["reorder_inner", "re", [1, 0]], ["compute_at_AS", "ot", 2], ["compute_at_WS", "ot", 1], ["AS_double_buffer", "ot", 1], ["WS_double_buffer", "ot", 0], ["auto_unroll_max_step", "ot", 0]]}, "result": [[0.004613860606060605], 0, 1.9434711933135986, 1615591380.3092256], "version": 0.2, "tvm_version": "0.8.dev0"}
{"input": ["cuda -keys=cuda,gpu -max_num_threads=1024 -thread_warp_size=32", "conv2d_HWNCnc_tensorcore.cuda", [["TENSOR", [14, 14, 32, 256], "int8"], ["TENSOR", [3, 3, 512, 256], "int8"], [2, 2], [1, 1, 1, 1], [1, 1], "int32"], {}], "config": {"index": 12726910, "code_hash": null, "entity": [["block_row_warps", "ot", 2], ["block_col_warps", "ot", 1], ["warp_row_tiles", "ot", 2], ["warp_col_tiles", "ot", 1], ["chunk", "ot", 1], ["fuse_pack", "ot", 1], ["split_block_k_nums", "ot", 4], ["vector_ws", "ot", 1], ["vector_as", "ot", 8], ["reorder_inner", "re", [0, 1]], ["compute_at_AS", "ot", 2], ["compute_at_WS", "ot", 0], ["AS_double_buffer", "ot", 0], ["WS_double_buffer", "ot", 1], ["auto_unroll_max_step", "ot", 512]]}, "result": [[0.00025306685585585584], 0, 2.085458755493164, 1615591393.0118718], "version": 0.2, "tvm_version": "0.8.dev0"}
{"input": ["cuda -keys=cuda,gpu -max_num_threads=1024 -thread_warp_size=32", "conv2d_HWNCnc_tensorcore.cuda", [["TENSOR", [14, 14, 32, 256], "int8"], ["TENSOR", [3, 3, 512, 256], "int8"], [2, 2], [1, 1, 1, 1], [1, 1], "int32"], {}], "config": {"index": 1188682, "code_hash": null, "entity": [["block_row_warps", "ot", 2], ["block_col_warps", "ot", 4], ["warp_row_tiles", "ot", 1], ["warp_col_tiles", "ot", 1], ["chunk", "ot", 8], ["fuse_pack", "ot", 0], ["split_block_k_nums", "ot", 1], ["vector_ws", "ot", 1], ["vector_as", "ot", 8], ["reorder_inner", "re", [0, 1]], ["compute_at_AS", "ot", 1], ["compute_at_WS", "ot", 2], ["AS_double_buffer", "ot", 0], ["WS_double_buffer", "ot", 0], ["auto_unroll_max_step", "ot", 0]]}, "result": [[0.00027671583640552993], 0, 2.0725138187408447, 1615591394.6484456], "version": 0.2, "tvm_version": "0.8.dev0"}
{"input": ["cuda -keys=cuda,gpu -max_num_threads=1024 -thread_warp_size=32", "conv2d_HWNCnc_tensorcore.cuda", [["TENSOR", [14, 14, 32, 256], "int8"], ["TENSOR", [3, 3, 512, 256], "int8"], [2, 2], [1, 1, 1, 1], [1, 1], "int32"], {}], "config": {"index": 5329843, "code_hash": null, "entity": [["block_row_warps", "ot", 2], ["block_col_warps", "ot", 4], ["warp_row_tiles", "ot", 16], ["warp_col_tiles", "ot", 1], ["chunk", "ot", 1], ["fuse_pack", "ot", 0], ["split_block_k_nums", "ot", 8], ["vector_ws", "ot", 8], ["vector_as", "ot", 1], ["reorder_inner", "re", [0, 1]], ["compute_at_AS", "ot", 1], ["compute_at_WS", "ot", 2], ["AS_double_buffer", "ot", 0], ["WS_double_buffer", "ot", 1], ["auto_unroll_max_step", "ot", 0]]}, "result": [[0.0022097318235294117], 0, 1.7688508033752441, 1615591395.9112494], "version": 0.2, "tvm_version": "0.8.dev0"}
{"input": ["cuda -keys=cuda,gpu -max_num_threads=1024 -thread_warp_size=32", "conv2d_HWNCnc_tensorcore.cuda", [["TENSOR", [14, 14, 32, 256], "int8"], ["TENSOR", [3, 3, 512, 256], "int8"], [2, 2], [1, 1, 1, 1], [1, 1], "int32"], {}], "config": {"index": 10611473, "code_hash": null, "entity": [["block_row_warps", "ot", 4], ["block_col_warps", "ot", 2], ["warp_row_tiles", "ot", 4], ["warp_col_tiles", "ot", 1], ["chunk", "ot", 4], ["fuse_pack", "ot", 0], ["split_block_k_nums", "ot", 8], ["vector_ws", "ot", 1], ["vector_as", "ot", 16], ["reorder_inner", "re", [1, 0]], ["compute_at_AS", "ot", 1], ["compute_at_WS", "ot", 0], ["AS_double_buffer", "ot", 1], ["WS_double_buffer", "ot", 0], ["auto_unroll_max_step", "ot", 512]]}, "result": [[0.00047069733463035024], 0, 3.0809426307678223, 1615591397.992598], "version": 0.2, "tvm_version": "0.8.dev0"}
{"input": ["cuda -keys=cuda,gpu -max_num_threads=1024 -thread_warp_size=32", "conv2d_HWNCnc_tensorcore.cuda", [["TENSOR", [14, 14, 32, 256], "int8"], ["TENSOR", [3, 3, 512, 256], "int8"], [2, 2], [1, 1, 1, 1], [1, 1], "int32"], {}], "config": {"index": 9023222, "code_hash": null, "entity": [["block_row_warps", "ot", 4], ["block_col_warps", "ot", 1], ["warp_row_tiles", "ot", 1], ["warp_col_tiles", "ot", 2], ["chunk", "ot", 8], ["fuse_pack", "ot", 1], ["split_block_k_nums", "ot", 4], ["vector_ws", "ot", 8], ["vector_as", "ot", 1], ["reorder_inner", "re", [1, 0]], ["compute_at_AS", "ot", 1], ["compute_at_WS", "ot", 1], ["AS_double_buffer", "ot", 0], ["WS_double_buffer", "ot", 0], ["auto_unroll_max_step", "ot", 512]]}, "result": [[0.0007558251758793971], 0, 3.4003632068634033, 1615591399.3711107], "version": 0.2, "tvm_version": "0.8.dev0"}
{"input": ["cuda -keys=cuda,gpu -max_num_threads=1024 -thread_warp_size=32", "conv2d_HWNCnc_tensorcore.cuda", [["TENSOR", [14, 14, 32, 256], "int8"], ["TENSOR", [3, 3, 512, 256], "int8"], [2, 2], [1, 1, 1, 1], [1, 1], "int32"], {}], "config": {"index": 7823529, "code_hash": null, "entity": [["block_row_warps", "ot", 1], ["block_col_warps", "ot", 1], ["warp_row_tiles", "ot", 2], ["warp_col_tiles", "ot", 2], ["chunk", "ot", 8], ["fuse_pack", "ot", 0], ["split_block_k_nums", "ot", 4], ["vector_ws", "ot", 1], ["vector_as", "ot", 16], ["reorder_inner", "re", [0, 1]], ["compute_at_AS", "ot", 0], ["compute_at_WS", "ot", 3], ["AS_double_buffer", "ot", 1], ["WS_double_buffer", "ot", 1], ["auto_unroll_max_step", "ot", 0]]}, "result": [[0.0003023846425], 0, 2.272639513015747, 1615591401.3943996], "version": 0.2, "tvm_version": "0.8.dev0"}
{"input": ["cuda -keys=cuda,gpu -max_num_threads=1024 -thread_warp_size=32", "conv2d_HWNCnc_tensorcore.cuda", [["TENSOR", [14, 14, 32, 256], "int8"], ["TENSOR", [3, 3, 512, 256], "int8"], [2, 2], [1, 1, 1, 1], [1, 1], "int32"], {}], "config": {"index": 14450339, "code_hash": null, "entity": [["block_row_warps", "ot", 4], ["block_col_warps", "ot", 1], ["warp_row_tiles", "ot", 8], ["warp_col_tiles", "ot", 8], ["chunk", "ot", 8], ["fuse_pack", "ot", 1], ["split_block_k_nums", "ot", 32], ["vector_ws", "ot", 8], ["vector_as", "ot", 16], ["reorder_inner", "re", [0, 1]], ["compute_at_AS", "ot", 3], ["compute_at_WS", "ot", 3], ["AS_double_buffer", "ot", 0], ["WS_double_buffer", "ot", 1], ["auto_unroll_max_step", "ot", 512]]}, "result": [[0.0195895294], 0, 9.639166355133057, 1615591403.727143], "version": 0.2, "tvm_version": "0.8.dev0"}
{"input": ["cuda -keys=cuda,gpu -max_num_threads=1024 -thread_warp_size=32", "conv2d_HWNCnc_tensorcore.cuda", [["TENSOR", [14, 14, 32, 256], "int8"], ["TENSOR", [3, 3, 512, 256], "int8"], [2, 2], [1, 1, 1, 1], [1, 1], "int32"], {}], "config": {"index": 18927105, "code_hash": null, "entity": [["block_row_warps", "ot", 1], ["block_col_warps", "ot", 4], ["warp_row_tiles", "ot", 2], ["warp_col_tiles", "ot", 4], ["chunk", "ot", 1], ["fuse_pack", "ot", 0], ["split_block_k_nums", "ot", 8], ["vector_ws", "ot", 1], ["vector_as", "ot", 1], ["reorder_inner", "re", [0, 1]], ["compute_at_AS", "ot", 2], ["compute_at_WS", "ot", 0], ["AS_double_buffer", "ot", 1], ["WS_double_buffer", "ot", 0], ["auto_unroll_max_step", "ot", 1500]]}, "result": [[0.0012860056495726496], 0, 2.6429805755615234, 1615591405.0658898], "version": 0.2, "tvm_version": "0.8.dev0"}
{"input": ["cuda -keys=cuda,gpu -max_num_threads=1024 -thread_warp_size=32", "conv2d_HWNCnc_tensorcore.cuda", [["TENSOR", [14, 14, 32, 256], "int8"], ["TENSOR", [3, 3, 512, 256], "int8"], [2, 2], [1, 1, 1, 1], [1, 1], "int32"], {}], "config": {"index": 8671394, "code_hash": null, "entity": [["block_row_warps", "ot", 4], ["block_col_warps", "ot", 1], ["warp_row_tiles", "ot", 8], ["warp_col_tiles", "ot", 4], ["chunk", "ot", 8], ["fuse_pack", "ot", 0], ["split_block_k_nums", "ot", 32], ["vector_ws", "ot", 1], ["vector_as", "ot", 16], ["reorder_inner", "re", [1, 0]], ["compute_at_AS", "ot", 2], ["compute_at_WS", "ot", 0], ["AS_double_buffer", "ot", 0], ["WS_double_buffer", "ot", 0], ["auto_unroll_max_step", "ot", 512]]}, "result": [[0.0019585795194805196], 0, 2.405428171157837, 1615591406.6264853], "version": 0.2, "tvm_version": "0.8.dev0"}
{"input": ["cuda -keys=cuda,gpu -max_num_threads=1024 -thread_warp_size=32", "conv2d_HWNCnc_tensorcore.cuda", [["TENSOR", [14, 14, 32, 256], "int8"], ["TENSOR", [3, 3, 512, 256], "int8"], [2, 2], [1, 1, 1, 1], [1, 1], "int32"], {}], "config": {"index": 6136575, "code_hash": null, "entity": [["block_row_warps", "ot", 1], ["block_col_warps", "ot", 4], ["warp_row_tiles", "ot", 2], ["warp_col_tiles", "ot", 8], ["chunk", "ot", 2], ["fuse_pack", "ot", 0], ["split_block_k_nums", "ot", 2], ["vector_ws", "ot", 1], ["vector_as", "ot", 16], ["reorder_inner", "re", [0, 1]], ["compute_at_AS", "ot", 3], ["compute_at_WS", "ot", 3], ["AS_double_buffer", "ot", 0], ["WS_double_buffer", "ot", 1], ["auto_unroll_max_step", "ot", 0]]}, "result": [[0.0007233772259615385], 0, 1.9714391231536865, 1615591408.075173], "version": 0.2, "tvm_version": "0.8.dev0"}
{"input": ["cuda -keys=cuda,gpu -max_num_threads=1024 -thread_warp_size=32", "conv2d_HWNCnc_tensorcore.cuda", [["TENSOR", [14, 14, 32, 256], "int8"], ["TENSOR", [3, 3, 512, 256], "int8"], [2, 2], [1, 1, 1, 1], [1, 1], "int32"], {}], "config": {"index": 19044110, "code_hash": null, "entity": [["block_row_warps", "ot", 4], ["block_col_warps", "ot", 1], ["warp_row_tiles", "ot", 4], ["warp_col_tiles", "ot", 4], ["chunk", "ot", 1], ["fuse_pack", "ot", 0], ["split_block_k_nums", "ot", 4], ["vector_ws", "ot", 8], ["vector_as", "ot", 16], ["reorder_inner", "re", [1, 0]], ["compute_at_AS", "ot", 2], ["compute_at_WS", "ot", 0], ["AS_double_buffer", "ot", 1], ["WS_double_buffer", "ot", 0], ["auto_unroll_max_step", "ot", 1500]]}, "result": [[0.0008814215795918367], 0, 2.925081729888916, 1615591416.9566782], "version": 0.2, "tvm_version": "0.8.dev0"}
{"input": ["cuda -keys=cuda,gpu -max_num_threads=1024 -thread_warp_size=32", "conv2d_HWNCnc_tensorcore.cuda", [["TENSOR", [14, 14, 32, 256], "int8"], ["TENSOR", [3, 3, 512, 256], "int8"], [2, 2], [1, 1, 1, 1], [1, 1], "int32"], {}], "config": {"index": 18500443, "code_hash": null, "entity": [["block_row_warps", "ot", 2], ["block_col_warps", "ot", 4], ["warp_row_tiles", "ot", 16], ["warp_col_tiles", "ot", 1], ["chunk", "ot", 1], ["fuse_pack", "ot", 0], ["split_block_k_nums", "ot", 1], ["vector_ws", "ot", 8], ["vector_as", "ot", 8], ["reorder_inner", "re", [1, 0]], ["compute_at_AS", "ot", 2], ["compute_at_WS", "ot", 3], ["AS_double_buffer", "ot", 0], ["WS_double_buffer", "ot", 0], ["auto_unroll_max_step", "ot", 1500]]}, "result": [[0.0006661565576923077], 0, 2.3496525287628174, 1615591418.6281438], "version": 0.2, "tvm_version": "0.8.dev0"}
{"input": ["cuda -keys=cuda,gpu -max_num_threads=1024 -thread_warp_size=32", "conv2d_HWNCnc_tensorcore.cuda", [["TENSOR", [14, 14, 32, 256], "int8"], ["TENSOR", [3, 3, 512, 256], "int8"], [2, 2], [1, 1, 1, 1], [1, 1], "int32"], {}], "config": {"index": 762014, "code_hash": null, "entity": [["block_row_warps", "ot", 4], ["block_col_warps", "ot", 1], ["warp_row_tiles", "ot", 8], ["warp_col_tiles", "ot", 8], ["chunk", "ot", 4], ["fuse_pack", "ot", 0], ["split_block_k_nums", "ot", 8], ["vector_ws", "ot", 1], ["vector_as", "ot", 16], ["reorder_inner", "re", [1, 0]], ["compute_at_AS", "ot", 1], ["compute_at_WS", "ot", 1], ["AS_double_buffer", "ot", 0], ["WS_double_buffer", "ot", 0], ["auto_unroll_max_step", "ot", 0]]}, "result": [[0.0035449378372093016], 0, 2.0629467964172363, 1615591420.0042396], "version": 0.2, "tvm_version": "0.8.dev0"}
{"input": ["cuda -keys=cuda,gpu -max_num_threads=1024 -thread_warp_size=32", "conv2d_HWNCnc_tensorcore.cuda", [["TENSOR", [14, 14, 32, 256], "int8"], ["TENSOR", [3, 3, 512, 256], "int8"], [2, 2], [1, 1, 1, 1], [1, 1], "int32"], {}], "config": {"index": 9512878, "code_hash": null, "entity": [["block_row_warps", "ot", 2], ["block_col_warps", "ot", 2], ["warp_row_tiles", "ot", 2], ["warp_col_tiles", "ot", 4], ["chunk", "ot", 8], ["fuse_pack", "ot", 1], ["split_block_k_nums", "ot", 16], ["vector_ws", "ot", 1], ["vector_as", "ot", 16], ["reorder_inner", "re", [0, 1]], ["compute_at_AS", "ot", 1], ["compute_at_WS", "ot", 2], ["AS_double_buffer", "ot", 0], ["WS_double_buffer", "ot", 0], ["auto_unroll_max_step", "ot", 512]]}, "result": [[0.001531384836734694], 0, 1.9710578918457031, 1615591421.7357547], "version": 0.2, "tvm_version": "0.8.dev0"}
{"input": ["cuda -keys=cuda,gpu -max_num_threads=1024 -thread_warp_size=32", "conv2d_HWNCnc_tensorcore.cuda", [["TENSOR", [14, 14, 32, 256], "int8"], ["TENSOR", [3, 3, 512, 256], "int8"], [2, 2], [1, 1, 1, 1], [1, 1], "int32"], {}], "config": {"index": 1945000, "code_hash": null, "entity": [["block_row_warps", "ot", 2], ["block_col_warps", "ot", 1], ["warp_row_tiles", "ot", 2], ["warp_col_tiles", "ot", 4], ["chunk", "ot", 1], ["fuse_pack", "ot", 1], ["split_block_k_nums", "ot", 1], ["vector_ws", "ot", 1], ["vector_as", "ot", 1], ["reorder_inner", "re", [0, 1]], ["compute_at_AS", "ot", 3], ["compute_at_WS", "ot", 3], ["AS_double_buffer", "ot", 0], ["WS_double_buffer", "ot", 0], ["auto_unroll_max_step", "ot", 0]]}, "result": [[0.00018783328784119106], 0, 1.7923023700714111, 1615591423.503843], "version": 0.2, "tvm_version": "0.8.dev0"}
{"input": ["cuda -keys=cuda,gpu -max_num_threads=1024 -thread_warp_size=32", "conv2d_HWNCnc_tensorcore.cuda", [["TENSOR", [14, 14, 32, 256], "int8"], ["TENSOR", [3, 3, 512, 256], "int8"], [2, 2], [1, 1, 1, 1], [1, 1], "int32"], {}], "config": {"index": 21299145, "code_hash": null, "entity": [["block_row_warps", "ot", 1], ["block_col_warps", "ot", 4], ["warp_row_tiles", "ot", 2], ["warp_col_tiles", "ot", 16], ["chunk", "ot", 4], ["fuse_pack", "ot", 1], ["split_block_k_nums", "ot", 1], ["vector_ws", "ot", 1], ["vector_as", "ot", 16], ["reorder_inner", "re", [0, 1]], ["compute_at_AS", "ot", 0], ["compute_at_WS", "ot", 1], ["AS_double_buffer", "ot", 0], ["WS_double_buffer", "ot", 1], ["auto_unroll_max_step", "ot", 1500]]}, "result": [[0.002742710727272727], 0, 3.8142311573028564, 1615591425.5830424], "version": 0.2, "tvm_version": "0.8.dev0"}
{"input": ["cuda -keys=cuda,gpu -max_num_threads=1024 -thread_warp_size=32", "conv2d_HWNCnc_tensorcore.cuda", [["TENSOR", [14, 14, 32, 256], "int8"], ["TENSOR", [3, 3, 512, 256], "int8"], [2, 2], [1, 1, 1, 1], [1, 1], "int32"], {}], "config": {"index": 16358076, "code_hash": null, "entity": [["block_row_warps", "ot", 1], ["block_col_warps", "ot", 1], ["warp_row_tiles", "ot", 16], ["warp_col_tiles", "ot", 4], ["chunk", "ot", 4], ["fuse_pack", "ot", 1], ["split_block_k_nums", "ot", 8], ["vector_ws", "ot", 1], ["vector_as", "ot", 8], ["reorder_inner", "re", [0, 1]], ["compute_at_AS", "ot", 2], ["compute_at_WS", "ot", 3], ["AS_double_buffer", "ot", 1], ["WS_double_buffer", "ot", 1], ["auto_unroll_max_step", "ot", 512]]}, "result": [[0.0006616577929515418], 0, 3.7953813076019287, 1615591426.99639], "version": 0.2, "tvm_version": "0.8.dev0"}
{"input": ["cuda -keys=cuda,gpu -max_num_threads=1024 -thread_warp_size=32", "conv2d_HWNCnc_tensorcore.cuda", [["TENSOR", [14, 14, 32, 256], "int8"], ["TENSOR", [3, 3, 512, 256], "int8"], [2, 2], [1, 1, 1, 1], [1, 1], "int32"], {}], "config": {"index": 14754606, "code_hash": null, "entity": [["block_row_warps", "ot", 1], ["block_col_warps", "ot", 4], ["warp_row_tiles", "ot", 1], ["warp_col_tiles", "ot", 1], ["chunk", "ot", 1], ["fuse_pack", "ot", 0], ["split_block_k_nums", "ot", 2], ["vector_ws", "ot", 1], ["vector_as", "ot", 16], ["reorder_inner", "re", [1, 0]], ["compute_at_AS", "ot", 1], ["compute_at_WS", "ot", 0], ["AS_double_buffer", "ot", 1], ["WS_double_buffer", "ot", 1], ["auto_unroll_max_step", "ot", 512]]}, "result": [[0.00037162159012345676], 0, 3.9860551357269287, 1615591428.5072951], "version": 0.2, "tvm_version": "0.8.dev0"}
{"input": ["cuda -keys=cuda,gpu -max_num_threads=1024 -thread_warp_size=32", "conv2d_HWNCnc_tensorcore.cuda", [["TENSOR", [14, 14, 32, 256], "int8"], ["TENSOR", [3, 3, 512, 256], "int8"], [2, 2], [1, 1, 1, 1], [1, 1], "int32"], {}], "config": {"index": 24066237, "code_hash": null, "entity": [["block_row_warps", "ot", 1], ["block_col_warps", "ot", 2], ["warp_row_tiles", "ot", 2], ["warp_col_tiles", "ot", 1], ["chunk", "ot", 2], ["fuse_pack", "ot", 0], ["split_block_k_nums", "ot", 4], ["vector_ws", "ot", 1], ["vector_as", "ot", 8], ["reorder_inner", "re", [1, 0]], ["compute_at_AS", "ot", 1], ["compute_at_WS", "ot", 2], ["AS_double_buffer", "ot", 1], ["WS_double_buffer", "ot", 1], ["auto_unroll_max_step", "ot", 1500]]}, "result": [[0.0006155956434426229], 0, 7.750871896743774, 1615591430.4381185], "version": 0.2, "tvm_version": "0.8.dev0"}
{"input": ["cuda -keys=cuda,gpu -max_num_threads=1024 -thread_warp_size=32", "conv2d_HWNCnc_tensorcore.cuda", [["TENSOR", [14, 14, 32, 256], "int8"], ["TENSOR", [3, 3, 512, 256], "int8"], [2, 2], [1, 1, 1, 1], [1, 1], "int32"], {}], "config": {"index": 17974198, "code_hash": null, "entity": [["block_row_warps", "ot", 2], ["block_col_warps", "ot", 1], ["warp_row_tiles", "ot", 8], ["warp_col_tiles", "ot", 2], ["chunk", "ot", 2], ["fuse_pack", "ot", 1], ["split_block_k_nums", "ot", 2], ["vector_ws", "ot", 1], ["vector_as", "ot", 8], ["reorder_inner", "re", [1, 0]], ["compute_at_AS", "ot", 2], ["compute_at_WS", "ot", 2], ["AS_double_buffer", "ot", 0], ["WS_double_buffer", "ot", 0], ["auto_unroll_max_step", "ot", 1500]]}, "result": [[0.000264482974863388], 0, 4.93911337852478, 1615591432.5543573], "version": 0.2, "tvm_version": "0.8.dev0"}
